Frame 1198: 682 bytes on wire (5456 bits), 682 bytes captured (5456 bits)
    Encapsulation type: Ethernet (1)
    Arrival Time: Jan 13, 2025 16:35:06.455589000 CET
    UTC Arrival Time: Jan 13, 2025 15:35:06.455589000 UTC
    Epoch Arrival Time: 1736782506.455589000
    [Time shift for this packet: 0.000000000 seconds]
    [Time delta from previous captured frame: 0.001778000 seconds]
    [Time delta from previous displayed frame: 0.000000000 seconds]
    [Time since reference or first frame: 7.518077000 seconds]
    Frame Number: 1198
    Frame Length: 682 bytes (5456 bits)
    Capture Length: 682 bytes (5456 bits)
    [Frame is marked: False]
    [Frame is ignored: False]
    [Protocols in frame: eth:ethertype:ip:tcp:tls:http2]
Ethernet II, Src: Microsoft_6b:0b:a9 (00:15:5d:6b:0b:a9), Dst: Microsoft_35:74:89 (00:15:5d:35:74:89)
    Destination: Microsoft_35:74:89 (00:15:5d:35:74:89)
        Address: Microsoft_35:74:89 (00:15:5d:35:74:89)
        .... ..0. .... .... .... .... = LG bit: Globally unique address (factory default)
        .... ...0 .... .... .... .... = IG bit: Individual address (unicast)
    Source: Microsoft_6b:0b:a9 (00:15:5d:6b:0b:a9)
        Address: Microsoft_6b:0b:a9 (00:15:5d:6b:0b:a9)
        .... ..0. .... .... .... .... = LG bit: Globally unique address (factory default)
        .... ...0 .... .... .... .... = IG bit: Individual address (unicast)
    Type: IPv4 (0x0800)
Internet Protocol Version 4, Src: 142.250.194.110, Dst: 172.22.253.12
    0100 .... = Version: 4
    .... 0101 = Header Length: 20 bytes (5)
    Differentiated Services Field: 0xb8 (DSCP: EF PHB, ECN: Not-ECT)
        1011 10.. = Differentiated Services Codepoint: Expedited Forwarding (46)
        .... ..00 = Explicit Congestion Notification: Not ECN-Capable Transport (0)
    Total Length: 668
    Identification: 0x70bb (28859)
    000. .... = Flags: 0x0
        0... .... = Reserved bit: Not set
        .0.. .... = Don't fragment: Not set
        ..0. .... = More fragments: Not set
    ...0 0000 0000 0000 = Fragment Offset: 0
    Time to Live: 57
    Protocol: TCP (6)
    Header Checksum: 0x135d [validation disabled]
    [Header checksum status: Unverified]
    Source Address: 142.250.194.110
    Destination Address: 172.22.253.12
Transmission Control Protocol, Src Port: 443, Dst Port: 34300, Seq: 7673, Ack: 1854, Len: 616
    Source Port: 443
    Destination Port: 34300
    [Stream index: 2]
    [Conversation completeness: Incomplete, DATA (15)]
        ..0. .... = RST: Absent
        ...0 .... = FIN: Absent
        .... 1... = Data: Present
        .... .1.. = ACK: Present
        .... ..1. = SYN-ACK: Present
        .... ...1 = SYN: Present
        [Completeness Flags: ··DASS]
    [TCP Segment Len: 616]
    Sequence Number: 7673    (relative sequence number)
    Sequence Number (raw): 3811515834
    [Next Sequence Number: 8289    (relative sequence number)]
    Acknowledgment Number: 1854    (relative ack number)
    Acknowledgment number (raw): 1036401130
    1000 .... = Header Length: 32 bytes (8)
    Flags: 0x018 (PSH, ACK)
        000. .... .... = Reserved: Not set
        ...0 .... .... = Accurate ECN: Not set
        .... 0... .... = Congestion Window Reduced: Not set
        .... .0.. .... = ECN-Echo: Not set
        .... ..0. .... = Urgent: Not set
        .... ...1 .... = Acknowledgment: Set
        .... .... 1... = Push: Set
        .... .... .0.. = Reset: Not set
        .... .... ..0. = Syn: Not set
        .... .... ...0 = Fin: Not set
        [TCP Flags: ·······AP···]
    Window: 1044
    [Calculated window size: 267264]
    [Window size scaling factor: 256]
    Checksum: 0x6c5e [unverified]
    [Checksum Status: Unverified]
    Urgent Pointer: 0
    Options: (12 bytes), No-Operation (NOP), No-Operation (NOP), Timestamps
        TCP Option - No-Operation (NOP)
            Kind: No-Operation (1)
        TCP Option - No-Operation (NOP)
            Kind: No-Operation (1)
        TCP Option - Timestamps
            Kind: Time Stamp Option (8)
            Length: 10
            Timestamp value: 583335947: TSval 583335947, TSecr 2521390179
            Timestamp echo reply: 2521390179
    [Timestamps]
        [Time since first frame in this TCP stream: 0.265575000 seconds]
        [Time since previous frame in this TCP stream: 0.001778000 seconds]
    [SEQ/ACK analysis]
        [iRTT: 0.030088000 seconds]
        [Bytes in flight: 616]
        [Bytes sent since last PSH flag: 616]
    TCP payload (616 bytes)
    [PDU Size: 27]
    [PDU Size: 13]
Transport Layer Security
    TLSv1.3 Record Layer: Handshake Protocol: Multiple Handshake Messages
        Opaque Type: Application Data (23)
        Version: TLS 1.2 (0x0303)
        Length: 549
        [Content Type: Handshake (22)]
        Handshake Protocol: New Session Ticket
            Handshake Type: New Session Ticket (4)
            Length: 262
            TLS Session Ticket
                Session Ticket Lifetime Hint: 172800 seconds (2 days)
                Session Ticket Age Add: 24878523
                Session Ticket Nonce Length: 1
                Session Ticket Nonce: 00
                Session Ticket Length: 236
                Session Ticket [truncated]: 0276d67aea00a2e9951ce64146aa67a3efb4e906c6a566016780769bcfb0eb214e20261f26b77b743b546acac0604030f4d7866cb3b836f0521b7093472b81465bc35fe2f9404f639a0bc7c6acc3407ffd12a3313293d9ed8dc6a6913cdb248d8d052d2ae01b9cf06aa
                Extensions Length: 12
                Extension: early_data (len=4)
                    Type: early_data (42)
                    Length: 4
                    Maximum Early Data Size: 14336
                Extension: Reserved (GREASE) (len=0)
                    Type: Reserved (GREASE) (35466)
                    Length: 0
                    Data: <MISSING>
        Handshake Protocol: New Session Ticket
            Handshake Type: New Session Ticket (4)
            Length: 262
            TLS Session Ticket
                Session Ticket Lifetime Hint: 172800 seconds (2 days)
                Session Ticket Age Add: 1494230779
                Session Ticket Nonce Length: 1
                Session Ticket Nonce: 01
                Session Ticket Length: 236
                Session Ticket [truncated]: 0276d67aea00a2e9951ce64146aa67a37b1553aec0965658da0d26ec9c58ff348622c1810378939cfd05eeb963827904eaad459afd428e01ff6185f35198ed18c73251b2968b268c8b19f288dd5777fe8e3bbcf7b0a63cdc6e9f8cb7ca6f8d1b459206740b8ebf0a22a
                Extensions Length: 12
                Extension: early_data (len=4)
                    Type: early_data (42)
                    Length: 4
                    Maximum Early Data Size: 14336
                Extension: Reserved (GREASE) (len=0)
                    Type: Reserved (GREASE) (35466)
                    Length: 0
                    Data: <MISSING>
    TLSv1.3 Record Layer: Application Data Protocol: HyperText Transfer Protocol 2
        Opaque Type: Application Data (23)
        Version: TLS 1.2 (0x0303)
        Length: 57
        [Content Type: Application Data (23)]
        Encrypted Application Data: 7b2a784e95ec58373ef28a945f598893e083b0d00e1bcae9b9ec674a98d4863446e31c205a2401bfffa3766f7aff736ce9d8d66871c5f02973
        [Application Data Protocol: HyperText Transfer Protocol 2]
HyperText Transfer Protocol 2
    Stream: SETTINGS, Stream ID: 0, Length 18
        Length: 18
        Type: SETTINGS (4)
        Flags: 0x00
            0000 000. = Unused: 0x00
            .... ...0 = ACK: False
        0... .... .... .... .... .... .... .... = Reserved: 0x0
        .000 0000 0000 0000 0000 0000 0000 0000 = Stream Identifier: 0
        Settings - Max concurrent streams : 100
            Settings Identifier: Max concurrent streams (3)
            Max concurrent streams: 100
        Settings - Initial Windows size : 1048576
            Settings Identifier: Initial Windows size (4)
            Initial Window Size: 1048576
        Settings - Max header list size : 65536
            Settings Identifier: Max header list size (6)
            Max header list size: 65536
HyperText Transfer Protocol 2
    Stream: WINDOW_UPDATE, Stream ID: 0, Length 4
        Length: 4
        Type: WINDOW_UPDATE (8)
        Flags: 0x00
            0000 0000 = Unused: 0x00
        0... .... .... .... .... .... .... .... = Reserved: 0x0
        .000 0000 0000 0000 0000 0000 0000 0000 = Stream Identifier: 0
        0... .... .... .... .... .... .... .... = Reserved: 0x0
        .000 0000 0000 1111 0000 0000 0000 0001 = Window Size Increment: 983041
        [Connection window size (before): 65535]
        [Connection window size (after): 1048576]

Frame 1440: 1026 bytes on wire (8208 bits), 1026 bytes captured (8208 bits)
    Encapsulation type: Ethernet (1)
    Arrival Time: Jan 13, 2025 16:35:09.083085000 CET
    UTC Arrival Time: Jan 13, 2025 15:35:09.083085000 UTC
    Epoch Arrival Time: 1736782509.083085000
    [Time shift for this packet: 0.000000000 seconds]
    [Time delta from previous captured frame: 0.000366000 seconds]
    [Time delta from previous displayed frame: 2.627496000 seconds]
    [Time since reference or first frame: 10.145573000 seconds]
    Frame Number: 1440
    Frame Length: 1026 bytes (8208 bits)
    Capture Length: 1026 bytes (8208 bits)
    [Frame is marked: False]
    [Frame is ignored: False]
    [Protocols in frame: eth:ethertype:ip:tcp:tls:http2]
Ethernet II, Src: Microsoft_6b:0b:a9 (00:15:5d:6b:0b:a9), Dst: Microsoft_35:74:89 (00:15:5d:35:74:89)
    Destination: Microsoft_35:74:89 (00:15:5d:35:74:89)
        Address: Microsoft_35:74:89 (00:15:5d:35:74:89)
        .... ..0. .... .... .... .... = LG bit: Globally unique address (factory default)
        .... ...0 .... .... .... .... = IG bit: Individual address (unicast)
    Source: Microsoft_6b:0b:a9 (00:15:5d:6b:0b:a9)
        Address: Microsoft_6b:0b:a9 (00:15:5d:6b:0b:a9)
        .... ..0. .... .... .... .... = LG bit: Globally unique address (factory default)
        .... ...0 .... .... .... .... = IG bit: Individual address (unicast)
    Type: IPv4 (0x0800)
Internet Protocol Version 4, Src: 142.250.77.227, Dst: 172.22.253.12
    0100 .... = Version: 4
    .... 0101 = Header Length: 20 bytes (5)
    Differentiated Services Field: 0xb8 (DSCP: EF PHB, ECN: Not-ECT)
        1011 10.. = Differentiated Services Codepoint: Expedited Forwarding (46)
        .... ..00 = Explicit Congestion Notification: Not ECN-Capable Transport (0)
    Total Length: 1012
    Identification: 0x3ae3 (15075)
    000. .... = Flags: 0x0
        0... .... = Reserved bit: Not set
        .0.. .... = Don't fragment: Not set
        ..0. .... = More fragments: Not set
    ...0 0000 0000 0000 = Fragment Offset: 0
    Time to Live: 121
    Protocol: TCP (6)
    Header Checksum: 0x7c68 [validation disabled]
    [Header checksum status: Unverified]
    Source Address: 142.250.77.227
    Destination Address: 172.22.253.12
Transmission Control Protocol, Src Port: 443, Dst Port: 53176, Seq: 5386, Ack: 1832, Len: 960
    Source Port: 443
    Destination Port: 53176
    [Stream index: 3]
    [Conversation completeness: Incomplete, DATA (15)]
        ..0. .... = RST: Absent
        ...0 .... = FIN: Absent
        .... 1... = Data: Present
        .... .1.. = ACK: Present
        .... ..1. = SYN-ACK: Present
        .... ...1 = SYN: Present
        [Completeness Flags: ··DASS]
    [TCP Segment Len: 960]
    Sequence Number: 5386    (relative sequence number)
    Sequence Number (raw): 45211333
    [Next Sequence Number: 6346    (relative sequence number)]
    Acknowledgment Number: 1832    (relative ack number)
    Acknowledgment number (raw): 1134441634
    1000 .... = Header Length: 32 bytes (8)
    Flags: 0x018 (PSH, ACK)
        000. .... .... = Reserved: Not set
        ...0 .... .... = Accurate ECN: Not set
        .... 0... .... = Congestion Window Reduced: Not set
        .... .0.. .... = ECN-Echo: Not set
        .... ..0. .... = Urgent: Not set
        .... ...1 .... = Acknowledgment: Set
        .... .... 1... = Push: Set
        .... .... .0.. = Reset: Not set
        .... .... ..0. = Syn: Not set
        .... .... ...0 = Fin: Not set
        [TCP Flags: ·······AP···]
    Window: 1044
    [Calculated window size: 267264]
    [Window size scaling factor: 256]
    Checksum: 0x5572 [unverified]
    [Checksum Status: Unverified]
    Urgent Pointer: 0
    Options: (12 bytes), No-Operation (NOP), No-Operation (NOP), Timestamps
        TCP Option - No-Operation (NOP)
            Kind: No-Operation (1)
        TCP Option - No-Operation (NOP)
            Kind: No-Operation (1)
        TCP Option - Timestamps
            Kind: Time Stamp Option (8)
            Length: 10
            Timestamp value: 748355806: TSval 748355806, TSecr 1264601596
            Timestamp echo reply: 1264601596
    [Timestamps]
        [Time since first frame in this TCP stream: 0.154577000 seconds]
        [Time since previous frame in this TCP stream: 0.000454000 seconds]
    [SEQ/ACK analysis]
        [iRTT: 0.025696000 seconds]
        [Bytes in flight: 960]
        [Bytes sent since last PSH flag: 960]
    TCP payload (960 bytes)
    [PDU Size: 27]
    [PDU Size: 13]
Transport Layer Security
    TLSv1.3 Record Layer: Handshake Protocol: Multiple Handshake Messages
        Opaque Type: Application Data (23)
        Version: TLS 1.2 (0x0303)
        Length: 893
        [Content Type: Handshake (22)]
        Handshake Protocol: New Session Ticket
            Handshake Type: New Session Ticket (4)
            Length: 434
            TLS Session Ticket
                Session Ticket Lifetime Hint: 172800 seconds (2 days)
                Session Ticket Age Add: 3939634321
                Session Ticket Nonce Length: 1
                Session Ticket Nonce: 00
                Session Ticket Length: 408
                Session Ticket [truncated]: 0276d67aea00a2e9951ce64146aa67a3c43ec6f3c567b31c3ad679c9cc84293c707b91748da9a5fc23b6ebc72d468f4ca6139a396b2204bba8d0490aa0c2b90e2fea2a5fcb9dd2d6ad41e2dc6367bd220dd3151e7526937d92405d7190eb6f5d68c5480c6f22cab7199
                Extensions Length: 12
                Extension: early_data (len=4)
                    Type: early_data (42)
                    Length: 4
                    Maximum Early Data Size: 14336
                Extension: Reserved (GREASE) (len=0)
                    Type: Reserved (GREASE) (31354)
                    Length: 0
                    Data: <MISSING>
        Handshake Protocol: New Session Ticket
            Handshake Type: New Session Ticket (4)
            Length: 434
            TLS Session Ticket
                Session Ticket Lifetime Hint: 172800 seconds (2 days)
                Session Ticket Age Add: 4253535582
                Session Ticket Nonce Length: 1
                Session Ticket Nonce: 01
                Session Ticket Length: 408
                Session Ticket [truncated]: 0276d67aea00a2e9951ce64146aa67a3222a02268d0798776441dd92669f669a93b24ecdb174d4a292a526e94d69472fe74c6a516d254efa1a40d70c553234f1d02b4a0e5e9e11a576ac9a469aa95281b0fe5014549016cb792827abb75bc3dde7c72da77a6afe851d3
                Extensions Length: 12
                Extension: early_data (len=4)
                    Type: early_data (42)
                    Length: 4
                    Maximum Early Data Size: 14336
                Extension: Reserved (GREASE) (len=0)
                    Type: Reserved (GREASE) (31354)
                    Length: 0
                    Data: <MISSING>
    TLSv1.3 Record Layer: Application Data Protocol: HyperText Transfer Protocol 2
        Opaque Type: Application Data (23)
        Version: TLS 1.2 (0x0303)
        Length: 57
        [Content Type: Application Data (23)]
        Encrypted Application Data: 812fa7ab37c558c8bd8a83427d0e34eab37fce22c29f5d7fef64195ef5427e244895d18fa1c12206343a493f123d4c78ca8a32f78cb4668610
        [Application Data Protocol: HyperText Transfer Protocol 2]
HyperText Transfer Protocol 2
    Stream: SETTINGS, Stream ID: 0, Length 18
        Length: 18
        Type: SETTINGS (4)
        Flags: 0x00
            0000 000. = Unused: 0x00
            .... ...0 = ACK: False
        0... .... .... .... .... .... .... .... = Reserved: 0x0
        .000 0000 0000 0000 0000 0000 0000 0000 = Stream Identifier: 0
        Settings - Max concurrent streams : 100
            Settings Identifier: Max concurrent streams (3)
            Max concurrent streams: 100
        Settings - Initial Windows size : 1048576
            Settings Identifier: Initial Windows size (4)
            Initial Window Size: 1048576
        Settings - Max header list size : 65536
            Settings Identifier: Max header list size (6)
            Max header list size: 65536
HyperText Transfer Protocol 2
    Stream: WINDOW_UPDATE, Stream ID: 0, Length 4
        Length: 4
        Type: WINDOW_UPDATE (8)
        Flags: 0x00
            0000 0000 = Unused: 0x00
        0... .... .... .... .... .... .... .... = Reserved: 0x0
        .000 0000 0000 0000 0000 0000 0000 0000 = Stream Identifier: 0
        0... .... .... .... .... .... .... .... = Reserved: 0x0
        .000 0000 0000 1111 0000 0000 0000 0001 = Window Size Increment: 983041
        [Connection window size (before): 65535]
        [Connection window size (after): 1048576]

Frame 1481: 1038 bytes on wire (8304 bits), 1038 bytes captured (8304 bits)
    Encapsulation type: Ethernet (1)
    Arrival Time: Jan 13, 2025 16:35:09.184810000 CET
    UTC Arrival Time: Jan 13, 2025 15:35:09.184810000 UTC
    Epoch Arrival Time: 1736782509.184810000
    [Time shift for this packet: 0.000000000 seconds]
    [Time delta from previous captured frame: 0.002202000 seconds]
    [Time delta from previous displayed frame: 0.101725000 seconds]
    [Time since reference or first frame: 10.247298000 seconds]
    Frame Number: 1481
    Frame Length: 1038 bytes (8304 bits)
    Capture Length: 1038 bytes (8304 bits)
    [Frame is marked: False]
    [Frame is ignored: False]
    [Protocols in frame: eth:ethertype:ip:tcp:tls:http2]
Ethernet II, Src: Microsoft_6b:0b:a9 (00:15:5d:6b:0b:a9), Dst: Microsoft_35:74:89 (00:15:5d:35:74:89)
    Destination: Microsoft_35:74:89 (00:15:5d:35:74:89)
        Address: Microsoft_35:74:89 (00:15:5d:35:74:89)
        .... ..0. .... .... .... .... = LG bit: Globally unique address (factory default)
        .... ...0 .... .... .... .... = IG bit: Individual address (unicast)
    Source: Microsoft_6b:0b:a9 (00:15:5d:6b:0b:a9)
        Address: Microsoft_6b:0b:a9 (00:15:5d:6b:0b:a9)
        .... ..0. .... .... .... .... = LG bit: Globally unique address (factory default)
        .... ...0 .... .... .... .... = IG bit: Individual address (unicast)
    Type: IPv4 (0x0800)
Internet Protocol Version 4, Src: 142.250.193.202, Dst: 172.22.253.12
    0100 .... = Version: 4
    .... 0101 = Header Length: 20 bytes (5)
    Differentiated Services Field: 0x00 (DSCP: CS0, ECN: Not-ECT)
        0000 00.. = Differentiated Services Codepoint: Default (0)
        .... ..00 = Explicit Congestion Notification: Not ECN-Capable Transport (0)
    Total Length: 1024
    Identification: 0x6116 (24854)
    000. .... = Flags: 0x0
        0... .... = Reserved bit: Not set
        .0.. .... = Don't fragment: Not set
        ..0. .... = More fragments: Not set
    ...0 0000 0000 0000 = Fragment Offset: 0
    Time to Live: 120
    Protocol: TCP (6)
    Header Checksum: 0xe3f9 [validation disabled]
    [Header checksum status: Unverified]
    Source Address: 142.250.193.202
    Destination Address: 172.22.253.12
Transmission Control Protocol, Src Port: 443, Dst Port: 53516, Seq: 5751, Ack: 1806, Len: 972
    Source Port: 443
    Destination Port: 53516
    [Stream index: 4]
    [Conversation completeness: Incomplete, DATA (15)]
        ..0. .... = RST: Absent
        ...0 .... = FIN: Absent
        .... 1... = Data: Present
        .... .1.. = ACK: Present
        .... ..1. = SYN-ACK: Present
        .... ...1 = SYN: Present
        [Completeness Flags: ··DASS]
    [TCP Segment Len: 972]
    Sequence Number: 5751    (relative sequence number)
    Sequence Number (raw): 2637633088
    [Next Sequence Number: 6723    (relative sequence number)]
    Acknowledgment Number: 1806    (relative ack number)
    Acknowledgment number (raw): 2632647324
    1000 .... = Header Length: 32 bytes (8)
    Flags: 0x018 (PSH, ACK)
        000. .... .... = Reserved: Not set
        ...0 .... .... = Accurate ECN: Not set
        .... 0... .... = Congestion Window Reduced: Not set
        .... .0.. .... = ECN-Echo: Not set
        .... ..0. .... = Urgent: Not set
        .... ...1 .... = Acknowledgment: Set
        .... .... 1... = Push: Set
        .... .... .0.. = Reset: Not set
        .... .... ..0. = Syn: Not set
        .... .... ...0 = Fin: Not set
        [TCP Flags: ·······AP···]
    Window: 1044
    [Calculated window size: 267264]
    [Window size scaling factor: 256]
    Checksum: 0x45b6 [unverified]
    [Checksum Status: Unverified]
    Urgent Pointer: 0
    Options: (12 bytes), No-Operation (NOP), No-Operation (NOP), Timestamps
        TCP Option - No-Operation (NOP)
            Kind: No-Operation (1)
        TCP Option - No-Operation (NOP)
            Kind: No-Operation (1)
        TCP Option - Timestamps
            Kind: Time Stamp Option (8)
            Length: 10
            Timestamp value: 2864985571: TSval 2864985571, TSecr 632442136
            Timestamp echo reply: 632442136
    [Timestamps]
        [Time since first frame in this TCP stream: 0.185507000 seconds]
        [Time since previous frame in this TCP stream: 0.002202000 seconds]
    [SEQ/ACK analysis]
        [iRTT: 0.034218000 seconds]
        [Bytes in flight: 972]
        [Bytes sent since last PSH flag: 972]
    TCP payload (972 bytes)
    [PDU Size: 27]
    [PDU Size: 13]
Transport Layer Security
    TLSv1.3 Record Layer: Handshake Protocol: Multiple Handshake Messages
        Opaque Type: Application Data (23)
        Version: TLS 1.2 (0x0303)
        Length: 905
        [Content Type: Handshake (22)]
        Handshake Protocol: New Session Ticket
            Handshake Type: New Session Ticket (4)
            Length: 440
            TLS Session Ticket
                Session Ticket Lifetime Hint: 172800 seconds (2 days)
                Session Ticket Age Add: 784355277
                Session Ticket Nonce Length: 1
                Session Ticket Nonce: 00
                Session Ticket Length: 414
                Session Ticket [truncated]: 0276d67aea00a2e9951ce64146aa67a3d6418bb1735a1d77e6f10d0c700081d4ada60583ab6b7a9a449b46a75a610203057c59c46705f88d3409da4d600441ef2636e2a38778001457f00b0d244ac7b84373e370c3fad2e5b27f7dd65b77d48a5b55b38b7a9ec99a93a
                Extensions Length: 12
                Extension: early_data (len=4)
                    Type: early_data (42)
                    Length: 4
                    Maximum Early Data Size: 14336
                Extension: Reserved (GREASE) (len=0)
                    Type: Reserved (GREASE) (14906)
                    Length: 0
                    Data: <MISSING>
        Handshake Protocol: New Session Ticket
            Handshake Type: New Session Ticket (4)
            Length: 440
            TLS Session Ticket
                Session Ticket Lifetime Hint: 172800 seconds (2 days)
                Session Ticket Age Add: 2610725027
                Session Ticket Nonce Length: 1
                Session Ticket Nonce: 01
                Session Ticket Length: 414
                Session Ticket [truncated]: 0276d67aea00a2e9951ce64146aa67a3fdf22c5ace8ab459e74baee58439ef23b63874b9e9f1e03ba02f03bf52cb581bcbe46ec9ed993c94d17e2127086e0487dc4bc9f555381c776c2fcdf3de7c01e41c62c04e244ad211885dba54e9ee1602da18c61d0a7732126d1
                Extensions Length: 12
                Extension: early_data (len=4)
                    Type: early_data (42)
                    Length: 4
                    Maximum Early Data Size: 14336
                Extension: Reserved (GREASE) (len=0)
                    Type: Reserved (GREASE) (14906)
                    Length: 0
                    Data: <MISSING>
    TLSv1.3 Record Layer: Application Data Protocol: HyperText Transfer Protocol 2
        Opaque Type: Application Data (23)
        Version: TLS 1.2 (0x0303)
        Length: 57
        [Content Type: Application Data (23)]
        Encrypted Application Data: 7c18994ac90fee5cf7ae8fb62e39f4fb918f8baeef1f3050ec11d8e9db58195590134fcfb52af83685748d621812b57b456d49d19537bf99b3
        [Application Data Protocol: HyperText Transfer Protocol 2]
HyperText Transfer Protocol 2
    Stream: SETTINGS, Stream ID: 0, Length 18
        Length: 18
        Type: SETTINGS (4)
        Flags: 0x00
            0000 000. = Unused: 0x00
            .... ...0 = ACK: False
        0... .... .... .... .... .... .... .... = Reserved: 0x0
        .000 0000 0000 0000 0000 0000 0000 0000 = Stream Identifier: 0
        Settings - Max concurrent streams : 100
            Settings Identifier: Max concurrent streams (3)
            Max concurrent streams: 100
        Settings - Initial Windows size : 1048576
            Settings Identifier: Initial Windows size (4)
            Initial Window Size: 1048576
        Settings - Max header list size : 65536
            Settings Identifier: Max header list size (6)
            Max header list size: 65536
HyperText Transfer Protocol 2
    Stream: WINDOW_UPDATE, Stream ID: 0, Length 4
        Length: 4
        Type: WINDOW_UPDATE (8)
        Flags: 0x00
            0000 0000 = Unused: 0x00
        0... .... .... .... .... .... .... .... = Reserved: 0x0
        .000 0000 0000 0000 0000 0000 0000 0000 = Stream Identifier: 0
        0... .... .... .... .... .... .... .... = Reserved: 0x0
        .000 0000 0000 1111 0000 0000 0000 0001 = Window Size Increment: 983041
        [Connection window size (before): 65535]
        [Connection window size (after): 1048576]

Frame 1491: 1040 bytes on wire (8320 bits), 1040 bytes captured (8320 bits)
    Encapsulation type: Ethernet (1)
    Arrival Time: Jan 13, 2025 16:35:09.241202000 CET
    UTC Arrival Time: Jan 13, 2025 15:35:09.241202000 UTC
    Epoch Arrival Time: 1736782509.241202000
    [Time shift for this packet: 0.000000000 seconds]
    [Time delta from previous captured frame: 0.010735000 seconds]
    [Time delta from previous displayed frame: 0.056392000 seconds]
    [Time since reference or first frame: 10.303690000 seconds]
    Frame Number: 1491
    Frame Length: 1040 bytes (8320 bits)
    Capture Length: 1040 bytes (8320 bits)
    [Frame is marked: False]
    [Frame is ignored: False]
    [Protocols in frame: eth:ethertype:ip:tcp:tls:http2]
Ethernet II, Src: Microsoft_6b:0b:a9 (00:15:5d:6b:0b:a9), Dst: Microsoft_35:74:89 (00:15:5d:35:74:89)
    Destination: Microsoft_35:74:89 (00:15:5d:35:74:89)
        Address: Microsoft_35:74:89 (00:15:5d:35:74:89)
        .... ..0. .... .... .... .... = LG bit: Globally unique address (factory default)
        .... ...0 .... .... .... .... = IG bit: Individual address (unicast)
    Source: Microsoft_6b:0b:a9 (00:15:5d:6b:0b:a9)
        Address: Microsoft_6b:0b:a9 (00:15:5d:6b:0b:a9)
        .... ..0. .... .... .... .... = LG bit: Globally unique address (factory default)
        .... ...0 .... .... .... .... = IG bit: Individual address (unicast)
    Type: IPv4 (0x0800)
Internet Protocol Version 4, Src: 142.250.194.134, Dst: 172.22.253.12
    0100 .... = Version: 4
    .... 0101 = Header Length: 20 bytes (5)
    Differentiated Services Field: 0x00 (DSCP: CS0, ECN: Not-ECT)
        0000 00.. = Differentiated Services Codepoint: Default (0)
        .... ..00 = Explicit Congestion Notification: Not ECN-Capable Transport (0)
    Total Length: 1026
    Identification: 0x1f64 (8036)
    000. .... = Flags: 0x0
        0... .... = Reserved bit: Not set
        .0.. .... = Don't fragment: Not set
        ..0. .... = More fragments: Not set
    ...0 0000 0000 0000 = Fragment Offset: 0
    Time to Live: 57
    Protocol: TCP (6)
    Header Checksum: 0x63ee [validation disabled]
    [Header checksum status: Unverified]
    Source Address: 142.250.194.134
    Destination Address: 172.22.253.12
Transmission Control Protocol, Src Port: 443, Dst Port: 54822, Seq: 5605, Ack: 1903, Len: 974
    Source Port: 443
    Destination Port: 54822
    [Stream index: 5]
    [Conversation completeness: Incomplete, DATA (15)]
        ..0. .... = RST: Absent
        ...0 .... = FIN: Absent
        .... 1... = Data: Present
        .... .1.. = ACK: Present
        .... ..1. = SYN-ACK: Present
        .... ...1 = SYN: Present
        [Completeness Flags: ··DASS]
    [TCP Segment Len: 974]
    Sequence Number: 5605    (relative sequence number)
    Sequence Number (raw): 3109051188
    [Next Sequence Number: 6579    (relative sequence number)]
    Acknowledgment Number: 1903    (relative ack number)
    Acknowledgment number (raw): 110659422
    1000 .... = Header Length: 32 bytes (8)
    Flags: 0x018 (PSH, ACK)
        000. .... .... = Reserved: Not set
        ...0 .... .... = Accurate ECN: Not set
        .... 0... .... = Congestion Window Reduced: Not set
        .... .0.. .... = ECN-Echo: Not set
        .... ..0. .... = Urgent: Not set
        .... ...1 .... = Acknowledgment: Set
        .... .... 1... = Push: Set
        .... .... .0.. = Reset: Not set
        .... .... ..0. = Syn: Not set
        .... .... ...0 = Fin: Not set
        [TCP Flags: ·······AP···]
    Window: 1043
    [Calculated window size: 267008]
    [Window size scaling factor: 256]
    Checksum: 0xc3cf [unverified]
    [Checksum Status: Unverified]
    Urgent Pointer: 0
    Options: (12 bytes), No-Operation (NOP), No-Operation (NOP), Timestamps
        TCP Option - No-Operation (NOP)
            Kind: No-Operation (1)
        TCP Option - No-Operation (NOP)
            Kind: No-Operation (1)
        TCP Option - Timestamps
            Kind: Time Stamp Option (8)
            Length: 10
            Timestamp value: 4112114525: TSval 4112114525, TSecr 1676193441
            Timestamp echo reply: 1676193441
    [Timestamps]
        [Time since first frame in this TCP stream: 0.204749000 seconds]
        [Time since previous frame in this TCP stream: 0.010735000 seconds]
    [SEQ/ACK analysis]
        [iRTT: 0.046266000 seconds]
        [Bytes in flight: 974]
        [Bytes sent since last PSH flag: 974]
    TCP payload (974 bytes)
    [PDU Size: 27]
    [PDU Size: 13]
Transport Layer Security
    TLSv1.3 Record Layer: Handshake Protocol: Multiple Handshake Messages
        Opaque Type: Application Data (23)
        Version: TLS 1.2 (0x0303)
        Length: 907
        [Content Type: Handshake (22)]
        Handshake Protocol: New Session Ticket
            Handshake Type: New Session Ticket (4)
            Length: 441
            TLS Session Ticket
                Session Ticket Lifetime Hint: 172799 seconds (1 day, 23 hours, 59 minutes, 59 seconds)
                Session Ticket Age Add: 2840737562
                Session Ticket Nonce Length: 1
                Session Ticket Nonce: 00
                Session Ticket Length: 415
                Session Ticket [truncated]: 0276d67aea00a2e9951ce64146aa67a3a673a46318e647132a4b441809e145c511ae8b567dc68aefb0b70f8de389f14c29528b9fe9ae3a9974d931b892ad82ce6d0ed776137b97b7b07b32fff78de07150c2faefc8eb2149748f361b40090ceb9c78f756d9acf8f4891
                Extensions Length: 12
                Extension: early_data (len=4)
                    Type: early_data (42)
                    Length: 4
                    Maximum Early Data Size: 14336
                Extension: Reserved (GREASE) (len=0)
                    Type: Reserved (GREASE) (10794)
                    Length: 0
                    Data: <MISSING>
        Handshake Protocol: New Session Ticket
            Handshake Type: New Session Ticket (4)
            Length: 441
            TLS Session Ticket
                Session Ticket Lifetime Hint: 172799 seconds (1 day, 23 hours, 59 minutes, 59 seconds)
                Session Ticket Age Add: 208182389
                Session Ticket Nonce Length: 1
                Session Ticket Nonce: 01
                Session Ticket Length: 415
                Session Ticket [truncated]: 0276d67aea00a2e9951ce64146aa67a3fe0e67ca48b5205ea454ab988957ce177af9e349360cd2ebdd90ba45a755937e811962fab144333c30f390ecf65f4a20faa04f1e6477e8400d98c9297216ee7339e9489b75517e1a249966f40a1dd04bde15aa207c7add989c6
                Extensions Length: 12
                Extension: early_data (len=4)
                    Type: early_data (42)
                    Length: 4
                    Maximum Early Data Size: 14336
                Extension: Reserved (GREASE) (len=0)
                    Type: Reserved (GREASE) (10794)
                    Length: 0
                    Data: <MISSING>
    TLSv1.3 Record Layer: Application Data Protocol: HyperText Transfer Protocol 2
        Opaque Type: Application Data (23)
        Version: TLS 1.2 (0x0303)
        Length: 57
        [Content Type: Application Data (23)]
        Encrypted Application Data: c1763ecb8c587df26bd4eeda354243d03d3c16e8ed0888e891204166ee9bdb7cb6d7240b33e38cfdf44ab76f792f0fdacf9533343a376dfe28
        [Application Data Protocol: HyperText Transfer Protocol 2]
HyperText Transfer Protocol 2
    Stream: SETTINGS, Stream ID: 0, Length 18
        Length: 18
        Type: SETTINGS (4)
        Flags: 0x00
            0000 000. = Unused: 0x00
            .... ...0 = ACK: False
        0... .... .... .... .... .... .... .... = Reserved: 0x0
        .000 0000 0000 0000 0000 0000 0000 0000 = Stream Identifier: 0
        Settings - Max concurrent streams : 100
            Settings Identifier: Max concurrent streams (3)
            Max concurrent streams: 100
        Settings - Initial Windows size : 1048576
            Settings Identifier: Initial Windows size (4)
            Initial Window Size: 1048576
        Settings - Max header list size : 65536
            Settings Identifier: Max header list size (6)
            Max header list size: 65536
HyperText Transfer Protocol 2
    Stream: WINDOW_UPDATE, Stream ID: 0, Length 4
        Length: 4
        Type: WINDOW_UPDATE (8)
        Flags: 0x00
            0000 0000 = Unused: 0x00
        0... .... .... .... .... .... .... .... = Reserved: 0x0
        .000 0000 0000 0000 0000 0000 0000 0000 = Stream Identifier: 0
        0... .... .... .... .... .... .... .... = Reserved: 0x0
        .000 0000 0000 1111 0000 0000 0000 0001 = Window Size Increment: 983041
        [Connection window size (before): 65535]
        [Connection window size (after): 1048576]

Frame 3723: 158 bytes on wire (1264 bits), 158 bytes captured (1264 bits)
    Encapsulation type: Ethernet (1)
    Arrival Time: Jan 13, 2025 16:39:44.372996000 CET
    UTC Arrival Time: Jan 13, 2025 15:39:44.372996000 UTC
    Epoch Arrival Time: 1736782784.372996000
    [Time shift for this packet: 0.000000000 seconds]
    [Time delta from previous captured frame: 0.001377000 seconds]
    [Time delta from previous displayed frame: 275.131794000 seconds]
    [Time since reference or first frame: 285.435484000 seconds]
    Frame Number: 3723
    Frame Length: 158 bytes (1264 bits)
    Capture Length: 158 bytes (1264 bits)
    [Frame is marked: False]
    [Frame is ignored: False]
    [Protocols in frame: eth:ethertype:ip:tcp:tls:http2]
Ethernet II, Src: Microsoft_35:74:89 (00:15:5d:35:74:89), Dst: Microsoft_6b:0b:a9 (00:15:5d:6b:0b:a9)
    Destination: Microsoft_6b:0b:a9 (00:15:5d:6b:0b:a9)
        Address: Microsoft_6b:0b:a9 (00:15:5d:6b:0b:a9)
        .... ..0. .... .... .... .... = LG bit: Globally unique address (factory default)
        .... ...0 .... .... .... .... = IG bit: Individual address (unicast)
    Source: Microsoft_35:74:89 (00:15:5d:35:74:89)
        Address: Microsoft_35:74:89 (00:15:5d:35:74:89)
        .... ..0. .... .... .... .... = LG bit: Globally unique address (factory default)
        .... ...0 .... .... .... .... = IG bit: Individual address (unicast)
    Type: IPv4 (0x0800)
Internet Protocol Version 4, Src: 172.22.253.12, Dst: 142.250.194.131
    0100 .... = Version: 4
    .... 0101 = Header Length: 20 bytes (5)
    Differentiated Services Field: 0x00 (DSCP: CS0, ECN: Not-ECT)
        0000 00.. = Differentiated Services Codepoint: Default (0)
        .... ..00 = Explicit Congestion Notification: Not ECN-Capable Transport (0)
    Total Length: 144
    Identification: 0x7944 (31044)
    010. .... = Flags: 0x2, Don't fragment
        0... .... = Reserved bit: Not set
        .1.. .... = Don't fragment: Set
        ..0. .... = More fragments: Not set
    ...0 0000 0000 0000 = Fragment Offset: 0
    Time to Live: 64
    Protocol: TCP (6)
    Header Checksum: 0xc682 [validation disabled]
    [Header checksum status: Unverified]
    Source Address: 172.22.253.12
    Destination Address: 142.250.194.131
Transmission Control Protocol, Src Port: 53550, Dst Port: 443, Seq: 1898, Ack: 5394, Len: 92
    Source Port: 53550
    Destination Port: 443
    [Stream index: 6]
    [Conversation completeness: Incomplete, DATA (15)]
        ..0. .... = RST: Absent
        ...0 .... = FIN: Absent
        .... 1... = Data: Present
        .... .1.. = ACK: Present
        .... ..1. = SYN-ACK: Present
        .... ...1 = SYN: Present
        [Completeness Flags: ··DASS]
    [TCP Segment Len: 92]
    Sequence Number: 1898    (relative sequence number)
    Sequence Number (raw): 826400896
    [Next Sequence Number: 1990    (relative sequence number)]
    Acknowledgment Number: 5394    (relative ack number)
    Acknowledgment number (raw): 947510407
    1000 .... = Header Length: 32 bytes (8)
    Flags: 0x018 (PSH, ACK)
        000. .... .... = Reserved: Not set
        ...0 .... .... = Accurate ECN: Not set
        .... 0... .... = Congestion Window Reduced: Not set
        .... .0.. .... = ECN-Echo: Not set
        .... ..0. .... = Urgent: Not set
        .... ...1 .... = Acknowledgment: Set
        .... .... 1... = Push: Set
        .... .... .0.. = Reset: Not set
        .... .... ..0. = Syn: Not set
        .... .... ...0 = Fin: Not set
        [TCP Flags: ·······AP···]
    Window: 502
    [Calculated window size: 64256]
    [Window size scaling factor: 128]
    Checksum: 0xfb23 [unverified]
    [Checksum Status: Unverified]
    Urgent Pointer: 0
    Options: (12 bytes), No-Operation (NOP), No-Operation (NOP), Timestamps
        TCP Option - No-Operation (NOP)
            Kind: No-Operation (1)
        TCP Option - No-Operation (NOP)
            Kind: No-Operation (1)
        TCP Option - Timestamps
            Kind: Time Stamp Option (8)
            Length: 10
            Timestamp value: 1988689042: TSval 1988689042, TSecr 4119714343
            Timestamp echo reply: 4119714343
    [Timestamps]
        [Time since first frame in this TCP stream: 0.159498000 seconds]
        [Time since previous frame in this TCP stream: 0.001377000 seconds]
    [SEQ/ACK analysis]
        [iRTT: 0.022177000 seconds]
        [Bytes in flight: 166]
        [Bytes sent since last PSH flag: 92]
    TCP payload (92 bytes)
    [PDU Size: 24]
    [PDU Size: 33]
    [PDU Size: 13]
Transport Layer Security
    TLSv1.3 Record Layer: Application Data Protocol: HyperText Transfer Protocol 2
        Opaque Type: Application Data (23)
        Version: TLS 1.2 (0x0303)
        Length: 87
        [Content Type: Application Data (23)]
        Encrypted Application Data: fa179b8cc442404973d1786020e2ac4b5c7d54a9629b479a85f2fd886153f90e8e730a18815e0f8a5202b33af5e1b3e70d9910b0619797010f19ddd6661860bb5f24ee2b410a2c2b967799bf1b08fcd08bfbc4835e8cbf
        [Application Data Protocol: HyperText Transfer Protocol 2]
HyperText Transfer Protocol 2
    Stream: Magic
        Magic: PRI * HTTP/2.0\r\n\r\nSM\r\n\r\n
HyperText Transfer Protocol 2
    Stream: SETTINGS, Stream ID: 0, Length 24
        Length: 24
        Type: SETTINGS (4)
        Flags: 0x00
            0000 000. = Unused: 0x00
